{
  "message_id": "fcore-techlead-2026-05-04-decision-issue106-assign-qa",
  "schema_type": "techlead_decision_packet",
  "schema_version": "1.0.0",
  "project": "fractal-core",
  "from_role": "techlead",
  "to_role": "authority-architect",
  "created_at": "2026-05-04T12:15:00Z",
  "correlation_id": "issue-106",
  "github_context": {
    "repo": "billyweisberg/fractal-core-python",
    "issue_number": 106,
    "pr_number": 107,
    "branch": "issue-106",
    "links": [
      "https://github.com/billyweisberg/fractal-core-python/issues/106",
      "https://github.com/billyweisberg/fractal-core-python/pull/107"
    ]
  },
  "payload": {
    "issue": {
      "number": 106,
      "url": "https://github.com/billyweisberg/fractal-core-python/issues/106"
    },
    "pr": {
      "number": 107,
      "url": "https://github.com/billyweisberg/fractal-core-python/pull/107",
      "ready_for_review": true
    },
    "source_packet_ref": {
      "path": "{{SOURCE_PACKET_PATH}}",
      "message_id": "fcore-py-2026-05-04-issue106-result"
    },
    "decision_type": "assign_qa",
    "decision_rationale": "The Dev result is complete enough for verification, and no additional scope narrowing is required before QA.",
    "target_role": "QA",
    "next_assignment_type": "verify_authorized_slice",
    "canonical_branch": "issue-106",
    "role_branch": null,
    "branch_owner_role": "TechLead",
    "lineage_state": "active",
    "lineage_action": "created",
    "source_branch": "issue-106",
    "superseded_branch": null,
    "worktree_hint": "issue-106-qa",
    "reset_reason": null,
    "work_item_status_update_intent": "qa_pending",
    "coder_run_brief_ref": {
      "path": "{{CODER_RUN_BRIEF_PATH}}",
      "schema_path": "{{CODER_RUN_BRIEF_SCHEMA_PATH}}",
      "brief_id": "fcore-coder-2026-05-02-issue106-retirement-boundary-diagnostics"
    },
    "coder_run_brief": {
      "brief_id": "fcore-coder-2026-05-02-issue106-retirement-boundary-diagnostics"
    },
    "coder_brief_resolution": {
      "package_id_external": "fcore-stage1-2026-05-02-issue106-retirement-boundary-diagnostics",
      "brief_id_external": "fcore-coder-2026-05-02-issue106-retirement-boundary-diagnostics",
      "readiness_state": "execution_ready",
      "parallel_group_id": null
    }
  },
  "authority_context": {
    "manifest_path": "{{AUTHORITY_MANIFEST_PATH}}",
    "authority_version": "2026-05-03.1",
    "milestone_id": "m1-reference-implementation",
    "phase_id": "p6-forward-semantic-target",
    "task_id": "py-p6-retirement-boundary-diagnostics"
  }
}
